{
  "task_id": "yunshu-system-audit",
  "checkpoint_id": "yunshu-system-audit-deliver-20260509-181835",
  "phase": "deliver",
  "created_at": "2026-05-09T10:18:35Z",
  "summary": "完成云舒系统完整执行逻辑验证文档与结构化验收证据",
  "completed": [
    "生成reports/yunshu-system-full-logic-validation-20260509.md",
    "生成reports/yunshu-system-audit-acceptance-evidence-20260509.json",
    "通过validate evidence/version-check/audit links/py_compile/checkpoint validate"
  ],
  "pending": [
    "修复verify run中文输出捕获缺陷",
    "统一adapter优先级与恢复事实源文档"
  ],
  "decisions": [
    "系统流程可执行但未完全机器强制落实，acceptance evidence状态标记为failed以反映系统级缺陷"
  ],
  "artifacts": [
    "reports/yunshu-system-full-logic-validation-20260509.md",
    "reports/yunshu-system-audit-acceptance-evidence-20260509.json",
    ".yunshu/verify-log.tsv"
  ],
  "risks": [
    "verify run中文输出可能误记passed且证据为空"
  ],
  "next_action": "优先修复scripts/yunshu.py的subprocess输出解码与证据空文件判定"
}
