{
  "task_id": "yunshu-system-audit",
  "checkpoint_id": "yunshu-system-audit-execute-20260509-175447",
  "phase": "execute",
  "created_at": "2026-05-09T09:54:47Z",
  "summary": "完成云舒系统静态调查与CLI动态验证，准备生成验证文档",
  "completed": [
    "读取SKILL/README/adapter/components/gates/schemas/scripts",
    "运行version-check/audit links/checkpoint validate/resume/verify run/py_compile"
  ],
  "pending": [
    "生成验证文档和acceptance evidence"
  ],
  "decisions": [
    "Codex环境未获显式子智能体授权，按adapter约束使用串行验证"
  ],
  "artifacts": [
    "scripts/yunshu.py",
    "components/*/SKILL.md",
    ".yunshu/verify-log.tsv"
  ],
  "risks": [
    "文档门禁多，部分仍为人工流程，CLI仅覆盖最小机器门禁"
  ],
  "next_action": "写入验证文档并执行验收校验"
}
